start	end	text
3838640	3846600	bien vamos a la siguiente media móvil vamos a poner una de 10 periodos que lo que va a ser
3846600	3856400	es ayudarnos a identificar esas zonas laterales donde podemos operar y donde la tendencia va a
3856400	3861880	cambiar para eso sirve bien pongamos una media móvil de 10 periodos entonces
3869160	3876320	esto sirve más también en spot en futuros como también llevamos una manipulación del
3876320	3886680	mercado bastante importante yo traigo un error para mostrárselos como en mi estrategia yo llevaba
3886680	3895880	todo bien una velita salió una justo me saqué el stop y luego sube y también quiero que lo vean
3895880	3902280	porque eso les va a pasar también si operan el mercado seguro que les pasa y cuando les pase no
3902280	3910520	se sientan mal porque nos pasa a todos bien en el estilo yo la voy a dejar así tal cual como
3910520	3915560	esté en azul sólo que la voy a poner un poco más fuerte para que usted la pueda ver bien así
3921040	3924840	y aquí vamos a ir a buscar el cambio de tendencia
3932280	3934280	es ese que teníamos ahí este
3936800	3944120	si usted se fija la tendencia la vamos a determinar bajista y aquí viene ya ponerse un poquito más
3944120	3954320	difícil si la media móvil azul está demasiado retirado de la de 55 esto volatilidad entonces
3954320	3962080	ante la volatilidad nosotros al primer impulso a la media de 55 no vamos a asumir que la tendencia
3962080	3966840	va a cambiar de bajista al cista este sólo es un robot el cista la media para seguir cayendo
3966840	3975880	pero si usted se fija que hacemos un mínimo más alto que el anterior entonces la media móvil la
3975880	3984600	distancia de la azul a la marrón se vuelve menos volátil entonces a partir de ahí comenzamos a
3984600	3996720	sospechar que la oferta está bajando hay menor oferta entonces por eso la distancia ahora es menor
3996720	4007480	aquí y este bajo es más alto que este si lo ven bien aquí usted se fija ya llevamos una zona
4007480	4013000	de compresión y este movimiento que está aquí este no fue cambio de tendencia porque este ni
4013000	4018680	siquiera logra llegar por arriba del máximo anterior entonces entre más cerca estemos del
4018680	4025240	máximo anterior esta es una zona no operable que no necesito que la entiendan ahorita porque eso lo
4025240	4030440	vamos a estudiar vamos pasito pasito no pero para que ya vayan agarrando la onda un poco más complejo
4030440	4038380	aquí ustedes se fijan que en este tramo ya las medias móviles están hombre están juntas la
4038380	4046380	volatilidad casi que desaparece entonces cuando nosotros vemos esto ahí es donde nosotros entramos
4046380	4058860	ponemos un stop y para arriba aquí aquí ni de broma aquí o aquí porque esa distancia de esas
4058860	4065900	medias móviles entre más separadas estén sólo van a hacer rebotes a la media para seguir cayendo
4065900	4072620	o subiendo porque eso aplica lo mismo para la tendencia el cista o bajista si no vamos a verlo
4072620	4079980	aquí o allá arriba mire agarremos el cambio de tendencia anterior
4086620	4087900	aquí por ejemplo
4087900	4097020	este es un gráfico diario veamos el semanal si quieren también para no ver también lo podemos
4097020	4102420	ver en una cripto o sea no necesariamente tiene que ser en bitcoin en la que ustedes quieran hombre
4102420	4108480	pero que también esté dentro del top del top 100 también porque yo no soy maximalista usted me puede
4108480	4115140	dar una y la vamos a ir a ver allí que les parece busquemos entonces una tendencia al cista en una
4115140	4120780	cripto y ustedes me la dan los que están en línea también practiquemos tendencias busquemos
4120780	4131300	alcistas bajistas y laterales diario semanal y mensual no tengo otras tendencias para futuros
4131300	4138660	en el de cuatro horas la utilizamos y pero tendencia no es la tendencia va a ser la menor
4138660	4147060	que es la diaria porque es la de spot y en cuatro horas buscamos operar en favor de la tendencia
4147060	4153820	menor de acuerdo a la teoría de charlie down la tendencia menor que llevamos es la diaria la
4153820	4160780	secundaria es la semanal y la primaria es la mensual el libro si lo quieren comprar se llama
4161740	4163980	la teoría de charlie down
4166100	4174940	es un librito como es 60 páginas pero esto está resumido o sea es lo bonito que aquí esto ya
4174940	4181940	tiene un backtesting hecho por mí y que ya está solo de comer no no hay que estudiarse a 60 páginas
4181940	4190580	me gusta hacerlo simple entonces vamos a buscar otra por ejemplo alguien me da una
4198140	4204380	mejor voy a seguir mejor sigamos sí hay disculpen pero
4207260	4210060	ustedes vayan haciendo sus pruebas ahí
4212020	4221620	y vámonos al presente antes de bico aquí porque al final en el presente es donde está el problema aquí
4226500	4227620	hoy es sábado
4229260	4237940	que día es hoy martes verdad ok hoy es martes listo que hacemos aquí esa es la
4237940	4243260	duda que siempre vamos a tener porque para nosotros siempre el presente siempre es el
4243260	4247940	presente para nosotros entonces como nos educan aquí atrás en todo esto y aquí
4251220	4259860	miren es que aquí nosotros esto hay que prepararse para entrar y obviamente vamos a usar un stop no
4261300	4267580	este es un lateral pero bueno sigamos las dos medias móviles ya saben verdad tendencias
4267980	4274220	alcista bajista lateral ahora vamos a poner el siguiente indicador solo quiero aclarar que
4274220	4283980	estas dos medias móviles no son indicadores es el precio si el volumen el precio y el tiempo
4285220	4292700	es lo que hace que una velita exista no puede existir una que no tenga eso yo les envié un
4292700	4299300	documento bueno ragúl les envió un documento en donde se explicaba las partes que tiene una
4299300	4304540	velita no o lo revisamos así rapidito rapidito todos todos lo manejan bien ya sí
4306940	4310860	no veámoslo rápido mire
4316940	4320020	agarremos esta última velita esta que está aquí
4320020	4328700	esto es importante entenderlo porque esta velita que está aquí
4331300	4336780	ustedes lo tienen en su documento yo no lo voy a poner porque aquí en vivo vamos mejor
4340700	4346180	voy a agarrar un anterior porque está no ha cerrado entonces yo no puedo juzgar una
4346180	4354540	velita porque está en desarrollo le hace falta seis horas con 40 minutos y 55 segundos para que
4354540	4362420	esta velita cierre entonces no la voy a juzgar todavía juzguemos otra agarremos cualquier otro ejemplo
4367700	4370860	puede ser cualquiera a mí lo que me interesa
4370860	4376340	que usted conozca que la velita tiene un tiempo
4377820	4384060	ese es el gráfico diario entonces su proyección va a ser a ganar a 10 días asumiendo que tiene
4384060	4390020	un patrón de entrada no listo la velita tiene tiempo tiene el precio máximo
4392420	4398580	asumamos que depende de la tendencia pero esto sea el precio de apertura de cierre el mínimo
4399380	4406380	tiene esos cuatro que esos son los que encuentran en el libro mínimo cierre apertura máximo pero
4406380	4414140	tiene un tiempo tiene un volumen aquí adentro o sea aquí hay una cantidad de bitcoin que se
4414140	4421860	negociaron en un día dentro de esta velita que pudieron haber sido mil bitcoin o 50 mil bitcoin
4421860	4430340	pero tiene un volumen entonces ese volumen que está aquí adentro como se mira con el tiempo si yo
4430340	4437260	quiero saber qué patrón tengo aquí aquí aquí adentro hay cinco ondas de ellos de ellos completitas
4437260	4444740	y desarrolladas pero no se ve por la temporalidad si yo quiero ver todo el patrón que pasó aquí lo
4444740	4455100	pongo en gráficos de una hora y esto se convierte así lo mira completo es como hacerle un zoom a la
4455100	4460740	velita y ver qué pasó adentro entonces allí va a tener tendencia el cista bajista laterales y todo
4460740	4470460	lo demás aparte de eso aquí vamos a tener la parte que es complicada que es la parte de
4470460	4477940	especulativa aquí hay gente que está especulando aquí hay exchanges no todos no pero hay algunos
4477940	4486060	que así pueden mover el precio unos 100 dolaritos por ahí porque ellos son juez y parte ellos saben
4486060	4493260	dónde están sus stop y no hay manera que digan que no y cómo van a decir que no si usted los
4493260	4499540	pone en la plataforma de ellos esa información que usted les está dando no hay manera que
4499540	4506860	digan no yo no sé dónde está el stop de mí de mis usuarios mentira ellos saben bien dónde están
4506860	4512180	entonces si usted pone el stop donde los tiene toda la gente de lo por hecho que va a perder
4513660	4521700	lo va a perder por eso yo nunca nunca lo pongo por debajo de 60 mil o sea si lo tienen 60 mil
4522580	4531140	lo ponen 59 mil 500 usted está ahí listo está de pechito porque todos los demás están ahí
4532220	4541740	no lo ponga ahí sí bien entonces ahí cerramos con la velita no máximo mínimo el cuerpo de la vela
4541740	4549660	digamos lo podemos considerar hasta como el volumen que se movió el cierre y de la tendencia va a
4549660	4556140	depender si es alcista o bajista pero no no podemos juzgarla bueno aquí sí porque es alcista
4556140	4565740	no pero en la vida real no hasta que haya cerrado en seguimos vamos a pasar al siguiente
4565740	4575180	indicador yo voy a poner a ver necesitamos saber si esta tendencia es fuerte alcista o si va a
4575180	4586460	cambiar a bajista entonces pongamos el squeeze en el documento ustedes tienen cómo ponerlo pongámoslo
4586460	4594660	juntos los que están en línea como en base a las 12 más aquí dice manuel en base a las 12 más
4594660	4602820	cuando comienza la tendencia alcista no se me adelanten que tenemos hoy mañana y pasado mañana
4602820	4611340	y todo eso lo vamos a trabajar pero vamos en orden el desarrollado todas las velas tienen dentro
4611340	4618500	un patrón de desarrollo si correcto veto espota hombre que gusto verte por acá veto de los que
4618500	4627420	siempre está en mi streaming amigo ya de años siempre en una velita van a tener todas las ondas
4628420	4637500	el punto es que ellos no sólo son los impulsos de ellos es complejo como le digo sólo para sacar
4637500	4647580	un no sé cómo un curso de ellos tomaría quizás unos 15 días super aburridos es que es aburrido yo
4647580	4653900	tengo un libro y honestamente no lo vi sólo agarré la parte que me sirve para ganar dinero y se acabó
4654180	4658900	porque yo no quiero saber mucho yo lo que quiero hacer es ganar dinero o alguien quiere
4660140	4666900	miren hay gente que sabe mucho y no tiene dinero entonces yo quiero ser el el que lo
4666900	4675020	hace simple y tener dinero y hasta no quiero líos pero si usted quiere estudiar él está bien pero
4675020	4681660	en cada velita tiene un patrón veamos el actual si ustedes ven en el gráfico diario es una velita
4681660	4688660	no entonces veamos qué está pasando en esa velita fácil no en el gráfico de cuatro horas mire
4690020	4694540	si usted me pregunta si esto es al sexto bajista es que no tiene preguntas es que lo dejamos desde
4694540	4699980	ayer en el quienes estuvieron ayer en el por la noche conmigo allá en el que lo dejamos para
4699980	4709140	abajo 61 mira dónde vaya ahora yo a bitcoin no lo voy a operar en short que me preparo sí pero
4709140	4718580	yo lo yo comentaba ayer que lo espero ya por debajo del 63.000 creo que está está un
4718580	4728740	poquitito alto pero está bien 61 y allí están mejor sí pero mire esto si acuerdan que hablábamos
4728740	4734940	de las tendencias este es un gráfico de cuatro horas aquí no llevo tendencia sin embargo esto
4734980	4740700	que usted ve aquí y luego lo corta aquí usted ya sabe por qué es porque en el diario ya le dije
4740700	4748660	que es un lateral entonces mientras la gente está viendo una tendencia en un gráfico diario nosotros
4748660	4755420	vimos un lateral antes de que se forme entonces como ya sabemos que es un lateral antes de que
4755420	4760020	se forme esto se le va a estar cruzando a cada rato y este cruce no significa que nos vamos a
4760020	4764980	cero significa nada más que es un lateral de la temporalidad más alta mire aquí se le cruce y
4764980	4772420	dicen a cero se va para arriba hoy sí 100.000 fácil para abajo a cero otra vez como que porque
4772420	4779700	hombre es en el gráfico diario ya vemos que ese es un lateral sí entonces todo este tramo que
4779700	4787180	ustedes ven aquí es como hacerle un zoom a la velita diaria ahora hagámosle un zoom más fuerte
4787420	4790980	a la velita que estábamos viendo vámonos al gráfico de una hora
4792940	4800860	es decir que entre digamos bajar de temporalidad es acercarse a la velita de la temporalidad más
4800860	4807980	alta como quien quiere ver un microbio si yo quiero saber qué está pasando en esta velita del
4807980	4814180	gráfico de una hora voy a un minuto y me va a salir un gráfico enorme pero nosotros no queremos
4814300	4822020	eso lo que nosotros queremos es tener claro lo que vamos a hacer no que está pasando aquí que
4822020	4829540	está cayendo 300 pesos eso a nosotros no nos sirve nosotros queremos ganar bien no esto no
4829540	4834260	esto está bien para la gente que está en futuros pero nosotros no estamos en futuros en este momento
4834260	4842460	bien seguimos vámonos a poner el el siguiente indicador yo voy a poner el squeeze tal cual
4842460	4844060	como viene ustedes lo ponen ahí
4849540	4851660	este estoy aquí
4855220	4861980	los que estén aquí casi todos ya lo tienen configurado pero es mejor hacerlo en la configuración
4861980	4871900	aquí yo solo le cambio este por este se acabó ahora vamos a estudiar este para qué nos va a
4871900	4885820	servir este ya lo pusieron jóvenes seguimos con este entonces bien ya tenemos identificada
4885820	4893540	la tendencia la volatilidad la distancia no bien ya sabemos que dentro de la velita tenemos
4893540	4900740	todos los impulsos de ellos pero haciéndole un zoom en cuatro horas o en una hora vamos a
4900740	4909860	identificar todos esos impulsos pero realmente nos importa saber eso a mí no a mí no yo lo
4909860	4917140	que quiero tener claro es cómo ganar dinero el monitor este que está aquí nos marca los tiempos
4921500	4930220	esto yo lo hice allá en colombia y allí están estos colombianos humanos ahí está que pagaron
4930620	4938220	en línea también para escucharme aquí mire si esto está girado a la baja el adx no lo tengo aquí
4938220	4946500	pero si esto está girado a la baja aquí es un tremendo lateral que se va a formar como me van
4946500	4953340	a decir esto cómo se va a desplomar hombre si la tendencia es alcista la distancia entre las medias
4953340	4961220	móviles es importante a esto es un lateral o una caidita a la media de 55 para comprar yo lo abrí
4961220	4970300	aquí con ellos en colombia en vivo y justo me fue bien de acuerdo lo vamos a hacer con ustedes
4970300	4977740	pero mire mire aquí el precio lo que hace detenerse de subir no estamos diciendo que se cae sólo
4977740	4984300	estamos diciendo que a partir de aquí va a dejar de subir entonces yo habría aquí un spot grid 2
4984300	4989980	un neutral y un infinity que lo vamos a hacer con ustedes para que opere esto de forma automática
4990780	4995700	no lo voy a estar operando yo lo va a hacer la herramienta que el exchange que yo utilizo
4995700	5007700	me da y listo ahí está el rango veamos otro ejemplo ya van a ver miren aquí aquí
5011980	5018220	miren cómo se gira la baja y miren lo que hace el precio nada esto es un lateral
5018220	5025300	es pasado lo estamos viendo mí y porque hace un lateral porque su tendencia es
5025300	5032540	alcista y la distancia de las medias móviles sigue siendo amplia cuidadito cuando usted vea
5032540	5041500	por ejemplo que se forma esto esto es un lateral pero con medias móviles una encima de otra ahí
5041500	5046620	si tengan cuidado ahí hay que tener cuidado aquí
5049980	5056900	aquí no esto está para comprar mire la distancia que llevamos aquí después de un lateral el
5056900	5064420	monitor toca el punto 0 y esto no cae o sea que hay un tiempo en el que esta gente no vendió
5064420	5071100	y para que un precio caiga tienen que haber ventas entonces lo que me dice este lateral que
5071100	5077820	se forma aquí cuando el monitor está girado a la baja es que los que compraron aquí atrás no
5077820	5085660	están vendiendo entonces si no venden cuando pasa el tiempo tengo que volver a comprar yo pero
5085660	5092220	mientras tanto aquí no salimos no salimos porque aquí hay un riesgo nosotros decimos esto va a ser
5092220	5099420	un lateral o caída inicialmente hasta la media de 55 como aquí por ejemplo mire
5106380	5114380	la digamos el dibujito no tiene que ser perfecto si se fija a partir de aquí ya nos estaba dando
5114380	5122020	indicios como la temporalidad es diaria era difícil verla porque en una sola velita
5122020	5129060	cayó por eso a veces nos toca que adelantarnos al lindy porque este es un indicador los indicadores
5129060	5137380	son tardillos entonces el precio cae hasta la media de 55 pero se forma todo un valle rojo y
5137380	5144980	no logra romper con fuerza compras para nosotros porque no salimos entonces aquí porque la gente
5144980	5152460	me dice para qué te sale a salir aquí si vuelves a entrar aquí porque aquí hay un tiempo que la
5152460	5159500	gente no lo toma en cuenta este tiempo es en donde estos de atrás si venden veríamos un movimiento
5159500	5169660	así por oferta no están vendiendo o si vemos un lateral es porque aquí abajo tenemos suficiente
5169660	5175300	presión compradora que está absorbiendo la oferta o sea aunque estos están vendiendo aquí
5175300	5181940	estamos nosotros comprando por eso como que estamos chineando el bebé aquí pasamos ahí 15 días
5181940	5187180	chineando el bebé no hay manera de que vaya a caer bueno no ser que luego salga pago con
5187180	5193900	alguna cosa pero eso ya nosotros no sabemos no entonces y así sucesivamente y pasa igual con
5193980	5202060	con la tendencia esta es una tendencia cista con la bajista pasa igual sólo que imagínese la usted
5202060	5210860	al revés pero pasa igual bien vamos al siguiente indicador vamos a usar el adx este que está aquí
5210860	5216500	yo lo voy a configurar rapidito como me gusta a mí también en su documento ahí está como configurarlo
5216500	5223860	pero los que no lo tengan sólo le quitan estos dos y le cambiamos el color a blanquito y un poquito
5223860	5234060	más grande listo luego lo agarro y lo suelto para que quede como yo lo tengo
5237220	5242980	ahora ya siento como que tiene más forma no ya va agarrando forma
5246300	5253540	ahora les explico el adx y ya van a ver cómo cuando tenemos todos los indicadores
5253540	5259780	cada uno se encarga de decirnos lo que necesitamos saber de lo que está pasando en el precio
5261340	5267700	es que es que miren miren aquí miren este miren este y miren este
5270300	5275740	aquí se nos gira el monitor a la baja y el adx agarra como una pequeña pendiente negativa
5275740	5280940	dentro de una tendencia cista como porque ya sabemos no estamos por arriba de la media con
5280940	5286620	una volatilidad el precio hace un lateral se lo voy a ir poniendo aquí en amarillo
5287620	5303340	este y luego aquí este el patrón es el mismo ve mire aquí ahora estamos acá la pregunta siempre va
5303340	5311580	a ser y aquí que hacemos porque en el pasado si yo comienzo a revisar lo vamos a ver perfecto
5311580	5318620	el objetivo de nosotros es aquí que hacemos aquí vamos a llegar a ese punto pero hasta el momento
5318620	5323700	ya saben verdad que tengamos nosotros una pendiente negativa con direccionalidad bajista
5323700	5331860	dentro de una tendencia cista es un lateral siempre que tengamos una distancia prudente entre la de 10
5331860	5334380	y la de 55 así
5337580	5345300	no esa cosa no falla ahí es fácil ganar dinero yo la honestamente les digo que aquí en estas
5345300	5352460	zonas es donde mejor me va porque mi estrategia para esto casi no falla aquí sí con este patrón en
5352460	5358100	específico quizás un 90 por ciento de acierto es de los más seguros que hay
5359100	5366460	si claro aquí lo abrí el grid ya cuando pasemos a la parte técnica o sea ya el
5366460	5372340	exchange a darle tú andas el mismo reloj que yo no cuál es el cual andas tú
5374700	5375980	ese es un tutor bueno
5378700	5380020	ah pero andamos cerca
5380020	5391740	no ese no lo trae este es un sky bueno no que me gustó de lo mismo a ver justo aquí
5391740	5396900	donde estamos en este momento se falta un poco más de caída entonces cuando nosotros vayamos a la
5396900	5404740	parte técnica la operativa ya a operar idealmente en un spot grid tenemos que abrirlo por la parte
5404740	5412620	más baja porque la primera compra es como la más grande que hace el grid entonces si nosotros
5412620	5419820	lo compramos es decir abrimos aquí abajo y sube ya hombre vamos a ganar pero si comienza a caer
5419820	5424540	se van a ir ejecutando las demás órdenes que tengamos abiertas eso lo vamos a ver en la parte
5424540	5432020	técnica ahora sigamos con los indicadores ah por cierto el la de x nos va a ayudar a saber si es
5432020	5437220	verdad que esto es una tendencia bajista y nos vamos a 40.000 eso no va a pasar por lo menos en
5437220	5444740	mi estrategia no me está diciendo esto no tiene fuerza para que un precio imagínese usted que
5444740	5452140	el precio es como una balanza como esto del signo libre no entre la oferta y la demanda entonces
5452140	5459940	cuanto la de x está por debajo de este punto 23 no hay fuerza ni para arriba ni para abajo entonces
5459940	5465820	el precio lo que va a hacer es comenzar a estrecharse y la gente lo que va a hacer después es hacer un
5465820	5474540	dibujito tipo así miren capaz que lo agarran de aquí yo no estoy diciendo que esté mal mi punto
5474540	5482140	nada más es que nosotros lo veamos antes porque a mí no me sirve nada venir a explicárselo cuando
5482140	5490300	ya esté aquí en la punta o sea para atrás pues desde aquí para atrás no fallo el punto es aquí
5490300	5498380	antes de que se origine porque si nosotros sabemos antes lo que va a ser podemos operarlo pero para
5498380	5505300	atrás yo no puedo operar entonces aquí esto lo que va a pasar desde mi punto de vista y por el
5505300	5512260	momento va bien porque eso lo hice desde que estaba en 62 mil 500 creo y los colombianos que
5512260	5520060	están conmigo se guardan bien bueno sigamos pero no no no hay que tenerle tanto miedo de que no
5520060	5526660	vamos a ir a cero eso tenemos suficiente espacio para que el precio vuelve y suba la caída hay
5526660	5536980	que aprovecharla para comprar bien me hace falta uno este es el volumen de rango fijo
5537980	5547860	básicamente eso es la base es el soporte y resistencias que lo podemos hacer de forma manual visual
5549140	5555380	podríamos usar los pivotes pero yo prefiero usar el volumen de rango fijo porque no me complica la
5555380	5564860	vida me dice dónde está el área no yo se lo voy a poner acá miren en indicadores se vienen donde
5564860	5571580	dice técnicos y van donde dice perfiles ahí lo tienen ustedes en el documento ahí se lo dejen y
5571580	5580860	buscan me parece que es este a ver si es y luego lo configuran tal cual como yo se los puse ahí en
5580860	5586020	el documento ahora sí todos lo tienen verdad porque me voy a pasar a mí y otro
5588980	5591380	alguien me dice cuánto le puse que creo que es así
5593180	5598620	porque de memoria tampoco me lo puedo hombre cuánto ok
5601340	5608220	aunque y de ahí los colores yo siempre lo dejo un azulito así y este así
5609060	5615060	como que no vaya listo vaya ahí ya deberíamos de estar todos listos
5618340	5619260	y lo guardo
5621500	5627940	bien ahora sí comenzamos a la parte que me emociona porque es que ya vi me encanta aquí
5629260	5633940	porque ahí donde nadie sabe qué hacer yo me levanto todos los días
5633940	5640980	eso hace que me levanten de la cama vaya siendo no me levanto me levanto con ganas
5640980	5651100	de saber qué va a ser aquí en el presente me emociona pero como yo estoy aquí tratando
5651100	5656820	de enseñar bien este asunto ya nos pasamos todo todo esto ya nos lo pasamos bien
5656820	5663460	ahora vamos ahí
5674580	5682140	aquí ya estamos hablando del grid trading por inteligencia artificial aplicaciones por
5682140	5690700	cada caso de proyección es decir que nosotros vamos a ocupar la herramienta correcta en cada
5690700	5698380	caso de mercado nada de que yo solo pero de una sola manera no vamos a utilizar la herramienta
5698380	5701100	correcta que tengamos del exchange en el caso correcto
5701100	5713620	y déjenme ver creo que me salté porque necesito quiero ver no aquí en el dibujito
5732100	5741060	bien en los que están en línea cómo vamos ahora sí ya tenemos la estrategia configurada listos
5741060	5748780	para buscar los patrones de entrada aquí comenzamos y yo voy a revisar como si ustedes
5748780	5753700	no existieran con todo respeto por la mañana cuando yo me levanto y veo si puedo comprar o no
5753700	5761660	lo voy a hacer tal cual entonces voy a seguir esa orden y usted solo fíjese porque a mí no me
5761660	5766500	gusta complicarme la vida y va a ver que en 10 minutos ya sé qué hacer a veces nada ver
5766500	5770860	películas o algo así porque no tengo entrada si preguntas
5783700	5793740	no sí sí lo vamos a hacer en sí sí sí no me voy a quedar callado o sea o sea voy a digamos voy
