start	end	text
1943320	1951800	por eso es spot y por eso las criptos te dan más ganancia que Bitcoin si lo sabes hacer bien aquí,
1952360	1959120	porque si usas stop aquí, qué tamaño vas a usar, si en un semanal te va a quedar 30% de stop,
1959120	1969400	40% de stop, yo no le veo sentido, por eso en el semanal yo voy a xrp después de las caídas,
1969400	1975760	verdad, a las criptos en las que yo creo que son proyectos buenos, que no son basura,
1975760	1982160	pues que hay algo detrás, que tiene gente, que tiene rostro, sin stop, listo,
1985640	1989520	sólo con micrófono porque como tengo a las personas en línea,
1992600	1999480	y en un diario con qué rentabilidad te vas, es que sobre el mismo tema, 10% de stop,
1999480	2006320	pero hacia arriba con qué rentabilidad, o sea, en un 20% hacia arriba cierras el train,
2006320	2014240	la rentabilidad no importa, cerrás cuando te dé patrón de salida, porque a ver,
2014240	2022120	que incluso puedes perder, entonces hacia arriba mucha gente te dice que el target es 3 a 1 y yo
2022120	2028240	digo y como saben el futuro, si es que para que suba algo tiene que meterle billete, entonces
2028240	2036120	cuánto tengo que meterle, no sé, a bitcoin, no sé, 30 billones, quién se los va a meter,
2036120	2045520	para que llegue a donde yo digo que va a llegar, no sé, entonces el target normalmente la gente se
2045520	2051160	lo inventa, esa es la verdad, porque no hay manera de saberlo, piénsenlo, el precio se mueve por
2051160	2056040	oferta y demanda, para que el precio suba tiene que haber demanda, para que haya demanda tiene que
2056040	2061760	entrar dinero, de dónde viene el dinero, quién lo tiene y por qué lo va a meter, hay tantas preguntas
2061760	2068440	y esto es demasiado especulativo y decir que yo voy a vender en 90.000, no, y hay gente que no vende
2068440	2075680	hasta que llega a 90.000 y termina perdiendo el stop, lo que estoy diciendo es que entran en 70.000
2075680	2083920	y dicen que van a vender en 90.000 y con un stop en 65, le sube a 80.000, no venden porque su
2083920	2091680	target está en 90.000, pero qué les pasa, o sea qué les pasa, si ya están en ganancias lo que hay que
2091680	2098000	hacer es proteger para no perder, eso es lo primero no perder y después hacia arriba nosotros lo dejamos
2098000	2105000	correr en spot hasta que veamos el patrón de salida que lo vamos a estudiar en ese documento
2105000	2112600	que ustedes tienen ahí, entonces cuando llegue el momento de salirse, nosotros incluso estemos
2112600	2119680	perdiendo, porque a veces es cierto, no nos ha tocado el stop, estamos 2% abajo, tenemos patrón
2119680	2128160	de salida, no salimos, no salimos, no hay opción, es que no llegó mi target, no, no se quede esperando
2128160	2136680	el stop loss, sálgase porque el patrón de salida ya lo tiene para salirse y a veces uno por no querer
2136680	2143160	perder un 2% pierde un 5%, entonces por eso los patrones de entrada y de salida se deben de respetar
2143160	2151720	tal cual, porque muchas veces no vamos a ganar, o sea entramos en algo en 90 dólares, pasa el tiempo,
2151720	2157400	no sube, usted ya sabe que si pasa el tiempo y no sube, la probabilidad es que va a caer, entonces
2157400	2163080	no espere el stop, sálgase antes con el patrón de salida, bien, entonces vamos a avanzar al siguiente
2163080	2169520	tema, yo asumo que esto ya estamos. Solo una pregunta Jaime. Ok, dime. Rápidamente, para la
2169520	2175720	billetera fría estabas mencionando hace ratito las dos marcas Ledger y Trezor, pero también en tus
2175720	2181760	streamings has compartido que tienes un nodo, creo es basado en Umbrell, ese es una buena opción de
2181760	2188400	billetera fría, o sea es más seguro tenerlo dentro de tu propio nodo de Umbrell o si quieres
2188400	2198640	algo más. Si tienes conocimiento de informática, sí, si no, no, porque si sea nivel mejor uso una
2198640	2205320	Trezor, en mi caso porque toda mi vida he trabajado en informática, o sea que mi profesión es
2205320	2213560	administrador de redes y servidores en equipos de protección perimetral de seguridad informática,
2213720	2220040	entonces en mi caso antes de que la gente logre llegar a mi nodo, yo tengo equipos de protección,
2220040	2226720	firewall pues, entonces no van a llegar tan fácil y antes de que llegue el ISP, es decir el
2226720	2235080	proveedor de servicios de internet, también tengo contratado un servicio de antiataques, digamos,
2235080	2239760	entonces para que logren llegar hasta donde está mi nodo, primero no creo que vayan a por mí,
2240760	2249880	van a ir a por los ISP, para el usuario normal, digamos, yo opino que usen una Trezor.
2251560	2257440	O sea, digamos, como más frío, más aislado el tener el Trezor que un nodo caliente,
2257440	2263280	un nodo que esté conectado, vaya, aun siendo tu propio nodo Umbrell, una máquina que tú
2263280	2270720	tienes aquí en físico. Sí, es mejor Trezor, en ese aspecto sí. Gracias.
2272200	2280440	El único problemita con la Trezor es que se la vayan a robar o que le tomen un screenshot a las
2280440	2286440	palabras de recuperación, el nivel de seguridad siempre va a depender del usuario, o sea de
2286440	2296640	nosotros, pero yo creo que la Trezor estaría bien a nivel general, está bien. Bien, entonces,
2298400	2309720	vamos a comenzar, ahora sí, yo asumo que ustedes si gustan vayan agarrando el documento, sí,
2309720	2315000	que es ese mismo, este que yo tengo en pantalla es el que ustedes tienen.
2320120	2326760	Váyanse a esa página que está ahí y vamos a hablar de las tendencias, esto es lo primero para...
2329040	2336600	El objetivo, como le dije desde el principio, es simple, nosotros compramos algo, lo que sea,
2336600	2342680	no importa, es como cualquier otro negocio, hay gente que se dedica a comprar vehículos y
2342680	2349440	compra y venta, esto es igual, solo que lo hacemos desde una silla en la laptop en nuestra casa,
2349440	2355360	es lo mismo, compramos barato y vendemos caro, se escucha fácil, pero la tendencia es nuestra
2355360	2364020	amiga cuando estamos en gráficos de spot diarios, semanales y mensuales, es nuestra amiga,
2364020	2373580	porque si operamos en contra de eso, primero no se puede, ¿por qué no? ¿Cómo vas a vender lo que
2373580	2379940	no tienes, qué es lo que haces en futuros? Los futuros por eso son un lio, porque cuando tú entras
2379940	2386460	en short estás vendiendo algo que no tienes, entonces en spot eso no se puede hacer, la única
2386460	2391980	manera de vender es que usted tenga lo que va a vender, por ejemplo bitcoin, si usted tiene bitcoin
2391980	2397540	usted puede vender, pero no puede vender si no tiene, eso es spot, entonces lo vamos a explicar así,
2398940	2405860	las tendencias, hay tres tipos de tendencias, yo las manejo en el mensual, en el semanal y en el diario,
2405860	2415740	para los que quieran, digamos como profundizar más en cada en cada tema, mi estrategia agarra
2415740	2424260	Wyckoff, Elliott y la teoría de Charlie Down y Fibonacci, esas tres, ustedes lo pueden anotar y luego
2424260	2430020	porque les digo algo, sólo con Elliott pasaríamos un mes aquí, esa cosa es un libro y con Wyckoff
2430020	2443980	peor, es enorme, entonces esto lo que yo les enseño es como un extracto, lo sacamos y ya
2443980	2452220	se los doy como listo para digerir, como el jugo de 20 naranjas, es esto, bien, las tendencias en
2452220	2458300	la vida real no son como las flechas que yo pongo en youtube, porque como la flecha es
2459900	2468340	es recta, pero en la vida real son así, siempre vamos a tener en la mayoría de los casos altos,
2468980	2478100	más altos y bajos, más altos que el anterior, como aquí en este movimiento, que esta es una
2478100	2486100	proyección que es pública en trading view o como aquí por ejemplo, entonces el punto es que nosotros
2486100	2492780	la media móvil de 55 periodos que ustedes o si no la tienen ya vamos a configurar la estrategia
2492780	2500660	para que la vayan viendo, esta es una media móvil de 55 periodos, entonces siempre que el precio en
2500660	2506020	un gráfico diario y semanal o mensual esté por arriba, el precio esté por arriba de la media de
2506020	2515500	55, esa es una tendencia alcista, listo, no nos vamos a complicar con las tendencias, recuerde
2515500	2523980	si el gráfico está por arriba de la media móvil de 55 periodos en una temporalidad diaria,
2523980	2532140	semanal o mensual, esa es una tendencia alcista y bitcoin hasta esta fecha jamás ha tenido una
2532140	2539940	tendencia bajista, nunca, en un mensual, en semanal sí, en diario también y más abajo no, pero en el
2539940	2550020	mensual nunca, de acuerdo, con las tendencias esto está fácil, esta, ya saben verdad, la media de 55
2550020	2555620	ya la vamos a ver, bueno es una media móvil de 55 pero igual la vamos a poner, recuerden la tendencia
2555620	2561700	alcista, aquí ustedes lo tienen anotado, no, pero yo se los explico, siempre que esté el precio por
2561700	2567100	arriba de la media móvil de 55 periodos vamos a operar en favor de esa tendencia, no en contra,
2567740	2575500	incluso en futuros, siempre a favor de la tendencia, después ya con los años que usted tenga muchas
2575500	2582360	horas de pantalla usted va a saber operar en short en los retrocesos de onda 2 y 4 eliot que
2582360	2589860	normalmente caen a la media de 55, o sea hace como un, al que yo le llamo te joden y luego cae a la
2589860	2596900	media de 55, ese short sí se puede operar pero ya es otro nivel, se requiere más experiencia porque
2596900	2601100	luego ni cae, solo lateralizan como lo está haciendo en este momento bitcoin en el gráfico
2601100	2606460	diario y luego sigue subiendo y uno queriendo agarrar el short y así vienen desde los 16 mil
2606460	2613180	dólares, mucha gente y vienen perdiendo porque no deberían de hacer eso, de operar contra tendencia,
2613180	2620860	en fin, vamos a la siguiente tendencia, a la tendencia lateral, ¿cómo identificamos nosotros
2621140	2628140	cuando el precio de bitcoin se va a meter en una tendencia lateral? Fíjense que mi estrategia para
2628140	2639460	identificar esto es casi perfecta, casi perfecta, yo recién vengo de Colombia y cuando estuve allá,
2639460	2645420	de hecho aquí creo que hay gente que estuvo conmigo en Colombia, yo les decía que se iba a formar
2645420	2654380	un lateral, esa no es una caída, estábamos en 62 mil 500 dólares, el precio justo rebota en una
2654380	2662180	onda A, B, llegamos a 72 mil 70 mil más o menos y comenzamos a caer otra vez y vamos en 65,
2662180	2668860	¿vimos verdad? Es que ese es el lateral, entonces ahora porque yo sé que aquí hay gente que estuvo
2668860	2676540	conmigo en Colombia y que pagó también en la línea aquí, ahí están en el chat. Cuando nosotros
2676540	2682300	sabemos que no vamos a meter en un lateral, vamos a utilizar la herramienta correcta para operar ese
2682300	2689580	lateral, no vamos a estar aquí queriendo operar este pedacito, luego este pedacito, por pedacitos
2689580	2695980	no, nosotros vamos a ser buenos en una parte del mercado, no en todo el mercado, todo el mercado
2696300	2703260	porque es mucho. Nosotros cuando veamos que tenemos el patrón de lateral, abrimos un spot
2703260	2713320	neutral grid, perdón, se opera solo esto y da ingresos, entonces ya le voy a mostrar yo en el
2713320	2717820	backtesting con una cuenta que tengo de 10 mil dólares para que la gente vaya viendo cómo se
2717820	2725780	hacen esos dos grids que abrí en Colombia y que dieron un resultado positivo, sí, entonces ahí
2725780	2735740	van a ver ustedes cómo podés ganar dinero en spot sin gastar tanto tu tiempo. Bien, sigamos con la
2735740	2741900	tendencia bajista, la tendencia bajista, simple verdad, si el precio está por debajo de la media
2741900	2747340	móvil de 55, vamos a asumir que es una tendencia bajista siempre que no sea un lateral,
2748380	2754060	porque aquí nos va a costar un poquitito porque cuando la tendencia es lateral la media móvil de
2754060	2760820	55 va aquí, miren, en medio, entonces la gente ve el precio por debajo de la media y dice que
2760820	2767340	es una tendencia bajista cuando no es así, este es un lateral, pero este nosotros lo vamos a tener
2767340	2773680	bien claro porque mi estrategia aquí no tiene dudas y tiene muy muy buen nivel de acierto aquí,
2774320	2779760	casi casi que no falla ahí, de hecho yo les he puesto un ejemplo, ahí lo tienen ustedes si
2779760	2783280	lo quieren ir a ver y creo que les dejo el gráfico,
2793440	2794400	ya van a ver,
2794400	2804200	solo para que vayan viendo ejemplos ya como en la vida real, no, por aquí tengo uno,
2821200	2822000	este es,
2824400	2837040	miren, cuando estábamos en esta zona yo comentaba que aquí, aquí sí va a ser un lateral justo
2837040	2846040	después de romper el máximo anterior, aquí, en el texto dice 31 mil, es una zona, pero en el
2846040	2852240	dibujito yo lo calculaba así porque si usted se fija aquí el monitor tiene una pendiente positiva
2852520	2859440	y el ADX también, pero como esto está en un gráfico semanal, ¿dónde está? creo que aquí se
2859440	2868960	lo puedo enseñar, aquí, sí, aquí, ¿verdad? ven que es un gráfico, es una velita semanal,
2868960	2886600	2, ok, 2, 1, 1, sí, bien, seguimos, como la velita es semanal el indicador es lento,
2886600	2894080	entonces si yo me llego a esperar a que esto se gire a la baja es porque el precio entonces
2894080	2900080	ya va a obtener una caída de 10 mil dólares, entonces yo tengo que adelantarme a que esto se
2900080	2906000	me gire a la baja, entonces si yo le doy play ustedes van a ver que el lateral se forma ese que
2906000	2915320	está ahí, miren, por eso les digo con mi estrategia es poco probable que fallen identificar esta zona,
2916560	2923120	entonces cuando la zona ya está identificada nosotros sabemos que va a ser esto y no estamos
2923120	2930680	ahí diciendo la velita 100 mil nos vamos a cero, otra vez a cero, ya sabemos que eso es un lateral
2930680	2936080	hombre, si sabemos que va a ser esto entonces nosotros utilizamos la herramienta correcta
2936080	2944360	para operar esto, ahora ¿cómo sabemos cuando esto termina? por el tiempo, cuando pasa el tiempo y
2944360	2951000	vemos que no cae entonces por aquí nos estaría dando una señal de entrada nuevamente porque ya
2951000	2963000	pasó este tiempo, con las tendencias estamos claro, preguntas sobre tendencias porque así
2963000	2969080	vamos a ir ya van a ver que al final vamos a tener un paquete donde usted va a identificar la
2969080	2977800	tendencia, si es un lateral, hombre que lo vamos a hacer bien, solo tendencias preguntas de tendencias
2977800	2981880	solamente, son tres, alcista, bajista y lateral
2987400	2994480	me pongo de pie porque soy bajito, adelante, identificaste aquí que se iba a formar este lateral
2994480	3001480	digo comenzó la tendencia alcista, lo identificaste porque estaba alcanzando el máximo anterior que
3001480	3009880	ya había golpeado dos veces o ¿cuál es el indicador que tú sabes, conoces, tienes que te
3009880	3015320	dice aquí se va a formar un lateral esta zona de duda? eso es lo que vamos a trabajar después
3018520	3023720	ya vas a ver cuando cuando hagamos la práctica ustedes van a ser capaces de identificarlo
3023720	3025720	incluso sin indicadores
3027720	3035920	pero vamos a ir despacito, en este momento solo preguntas de tendencias, si hay alguien que por
3035920	3041480	alguna razón no conozca la media móvil de 55 la configuramos y la vamos si quieren hagámosla así
3041480	3046280	mejor porque si no siento que meter alguna pregunta que ya la vamos a resolver
3046280	3055000	es que yo tenía uno, bueno mi duda es cuando son tendencias alcistas o bajistas
3055000	3060720	este cómo saber cuándo estás en la onda tres o cómo saber cuándo estás en... correcto
3062240	3070440	también, entonces mejor voy a continuar y las preguntas porque las voy a dejar para el final
3071400	3076280	porque lo que pasa es que al final me van a agarrar con preguntas del principio pero bien
3076280	3085000	vamos a continuar mejor, perdón, perdón, dame una pregunta, porque la media de 55 la que no
3085000	3092040	determina la tendencia, por el te joden, la de 50 está muy prostituida, hombre que la palabra es
3092040	3098520	fea pero me refiero a que todo mundo la usa entonces en un mercado regulado un doble techo
3098520	3104600	funciona bien pero en con nosotros eso es un seguro te joden quien compra en 72 mil después
3104600	3110800	de que rompe 69 ese es un tremendo te joden que en los libros de texto ustedes lo encuentran con
3110800	3121400	un doble techo entonces la gente en 69 abriendo short esto se cae ese es un doble techo le subió
3121400	3126960	72 mil 3 mil dólares y todos a la esquina porque aquí no funciona así aquí aquí esto está
3126960	3133560	manipulado está hecho para perder entonces por eso la de 55 si uso la de 50 me da un doble techo
3133560	3140360	un doble suelo si le pongo la de 55 ya estoy calculando esos cinco puntos cinco velitos el
3140360	3148600	siguiente movimiento el que rompe el máximo para liquidaciones y luego caer preguntas de los que
3148600	3153400	salen línea aquí tenemos una dicen cuando estamos en una tendencia lateral cómo sabemos que va a
3153400	3161880	salir a un lado o a otro por la fuerza del lado de x y por la tendencia previa por eso y eso ya
3161880	3167800	lo voy a pasar a explicar también pero vamos a ir en orden yo lo que quiero es que ustedes tengan
3167800	3174480	clara la gestión del capital el riesgo donde vamos a guardar los activos ya vimos tendencias
3174480	3178360	y vamos al siguiente paso sí listo bien
3182440	3189040	la parte más bonita es cuando comenzamos a operar porque ahí lo van a hacer ustedes en paper trading
3189040	3196680	yo lo voy a hacer en vivo ustedes no es decir ustedes están en un proceso yo ya tengo varios
3196680	3199760	años yo lo hago en vivo no hay problema yo abro la cuenta que
3212560	3219120	tienen configurado todos mi estrategia ya la tienen configurado hay alguien que no tenga
3219120	3225200	configurada la estrategia aunque vamos a configurarla todos en este momento porque a partir de ya
3225360	3233720	comenzamos a buscar y a identificar patrones de entrada yo lo voy a hacer con ustedes pero
3233720	3239440	apóyense en el documento que les he dado porque ahí está cómo configurarlo ya van a ver se lo voy
3239440	3246120	a ir poniendo y lo voy a hacer con ustedes ustedes ven en pantalla yo les he dejado los
3246120	3260480	exactamente igual como yo lo tengo configurado los indicadores todos y lo voy a hacer con ustedes
3276880	3286040	y de paso se conectan al paper trading verdad para que vayamos abriendo operaciones en el paper
3286040	3293000	trading y ustedes durante estos tres días vayan viendo los resultados como haciendo el backtesting
3294040	3295640	pero en paper trading verdad
3295640	3309720	y mejor hagámoslo con ejemplos reales porque como el documento que tienen yo lo hice como
3309720	3314760	unos bueno ya parece la fecha pero a mí me gusta más siempre en tiempo presente porque
3314760	3322320	en el pasado no voy a fallar nunca en el presente sí porque es una proyección que no se conoce
3325640	3340640	los que están en línea vamos a comenzar ustedes ya tienen configurada la estrategia
3342040	3349560	ok felipe dice que no vamos a hacerlo juntos con los que están en línea y de paso vamos a ver las
3349560	3358840	tendencias al cista lateral y bajista las tres hagámoslo en vivo mejor el documento si es
3358840	3365160	importante que lo tengan porque no sé por la noche cuando estén solos en el youtuber ustedes
3365160	3373280	se van a sentir como solitos entonces saca el documento y usted mira ve no sé el patrón no
3373280	3378240	que usted está viendo en pantalla y en ese documento yo le he dejado usted la explicación
3378240	3384480	del por qué es una entrada al cista entonces usted lo mira y dice sí no pues sí que está calcado
3385720	3391360	entra le pone su stop y ya ya no necesite que esté el youtuber allí con usted la par
3391360	3410560	y recuerden que mi estrategia barata no es yo o sea esto es el resultado de
3410560	3420400	de agarrar los indicadores de pago y buscar los gratuitos que sean funcionales no porque
3420400	3427960	esa cosa vale como 500 dólares mensuales quieren saber de qué de qué empresa es sólo por curiosidad
3431760	3434800	sí pero si acuerdan de qué empresa es
3436880	3443120	para no ser publicidad mejor no la muestro pero quiero que sepan que mi estrategia está basada
3444120	3450880	en una empresa que vende esos indicadores y son carísimos o sea se pagan creo que
3450880	3455400	500 mensuales mensuales por tener esos indicadores
3460840	3461440	bien
3464640	3471720	vamos a ver voy a crear un nuevo diseño y aquí le vamos a poner cualquier cosa
3473360	3481880	y estamos como usted vería esto en la vida real sólo en su casa así no hay nada bueno lo
3481880	3487400	que tenemos es el volumen por la parte baja que siempre vienen los exchange y el precio
3487400	3494280	y un lateral formado eso es una temporalidad diaria lo que voy a hacer es ir poniendo cada uno de los
3494280	3501520	indicadores y le voy a explicar para qué sirve si usted me pone atención esto lo hacemos rapidísimo
3501840	3506960	bueno no tan rápido pues pero que va a estar fácil mire la primera va a ser la media móvil de
3506960	3512840	hay otra cosa perdón si los colores a usted a mí no me afectan pero si los colores le afectan
3512840	3521280	quíteselos o sea el precio en sí no es rojo es verde no tiene color el precio no tiene color y
3521280	3528640	el volumen tampoco en este caso yo no se lo voy a quitar cuando ya tenga más experiencia que
3528640	3535480	aquí hay gente que ya tiene años haciendo esto no se los quita pero si es nuevo mejor quíteselos
3535480	3541200	porque ven una velita roja y salen todos corriendo miren ahí está aquí la gente está que nos joda
3541200	3549080	sienten que se va a cero que porque está roja dicen y es grande y que no lo miran es decir
3550040	3555400	puras velas verdes quieren por eso les digo yo quítenle el color saben que yo se lo voy a quitar
3555400	3562960	por ser un tema educativo se lo voy a quitar porque la verdad es que no tiene color esto es así
3562960	3591520	eso es así y aquí tienen miedo es un
3592320	3598440	nombre si no hay miedo aquí nosotros lo que tenemos que hacer es preparar la cartera para
3598440	3603640	comprar lo que pasa que no la vemos pero ya la vamos a ver miren la primera que vamos a
3603640	3611080	poner es una media móvil de 55 períodos que tiene un sentido que sea de 55 porque
3612280	3618320	la voy a configurar si no la tienen configúrenla conmigo los que están en línea si no la tienen
3618320	3627520	configúrenla conmigo si yo lo que hago es que le pongo un color x no yo ya me acostumbré aquí
3627520	3633000	esta sea de como marrón o sea así bueno no sé qué color la ven ustedes ahí pero el punto es
3636320	3643240	la voy a poner un poquito más grande y aquí en entrada de datos yo le pongo 55 en el documento
3643240	3652720	que yo les cree a ustedes tienen esa información entonces miren esa es una tendencia alcista es
3652720	3656520	aquí comenzamos se acuerdan que hace un momento estábamos hablando de tendencias
3658960	3665680	mire no es que viene la tendencia alcista viene desde más atrás esto está fácil mire
3665680	3678920	vamos aquí la media móvil de 55 nos sirve a nosotros para determinar que a partir de aquí
3678920	3685600	llevamos una tendencia alcista y cada vez que estamos en las zonas de por la so porque perfecta
3685600	3695520	no es no por ejemplo aquí aquí los hicieron dudar luego aquí luego aquí no tenemos que
3695520	3702020	dudar en estos casos lo que nosotros hacemos es poner un stop por debajo pero las zonas de
3702020	3712520	compra están claras aquí está la ruptura no aquí compra 1 2 3 4 aquí todavía no estamos cerca pero
3712520	3718760	todavía no pero la tendencia como es es alcista y no vamos a cambiarla hasta que
3718760	3724520	tenga el patrón de cambio de tendencia que ese lo vamos a estudiar si fácil no ahora veamos
3724520	3731720	la tendencia bajista aprovechando que lo tenemos ahí aquí mismo yo se las quito aquí le pongo así
3738400	3739200	y esto
3742760	3750000	el precio viene por debajo de la media móvil de 55 y estos son solo rebotas
3750000	3757680	alcistas para seguir cayendo igual aquí otra vez otra vez aquí rompe pero si usted se fija
3757680	3764240	este movimiento es más alto que estos dos como la tendencia previa que traigo es bajista este
3764240	3773560	es el te joden al que yo le llamo tj o totillo no aquí aquí aquí no se mete nadie en long si es
3773560	3781960	que la tendencia es bajista como vas a entrar en long aquí no entra y nadie no imposible
3784200	3788880	yo lo veo claro pero ustedes también lo van a ver claro más adelantito lo que yo quiero que
3788880	3798160	ustedes vean como el movimiento cuando hace laterales o caídas mire rebote y ahí va por
3798160	3805120	debajo de la media móvil de 55 aquí si yo les pongo la siguiente media móvil que es la de 10
3805120	3811120	periodos van a saber identificar en qué momento va a cambiar la tendencia de bajista alcista o
3811120	3820040	de alcista bajista sí porque esas dos nos ayudan a identificar los laterales ahora sí está más
3820040	3829480	fácil no ya podría ya viéndolo en vivo lo de las tendencias porque sólo para estudiar tendencias
3829480	3838640	si se compran un librito y van a ver es un poco más complejo pero nosotros nos vamos a lo más simple
